{
  "apiVersion": "contracts.platform/v1alpha1",
  "kind": "OffboardingPlan",
  "id": "offboard-oidc-lena-larsen",
  "subject": "oidc|lena.larsen",
  "requestedAt": "2025-09-01T08:00:00Z",
  "deadlineAt": "2025-09-01T09:00:00Z",
  "deadlineSeconds": 3600,
  "targets": ["sessions", "api-tokens", "shares", "scheduled-workflows", "ai-tool-grants"],
  "actions": [
    { "target": "sessions", "rightId": "sess-1", "action": "revoke", "at": "2025-09-01T08:00:05Z", "status": "done" },
    { "target": "api-tokens", "rightId": "tok-1", "action": "revoke", "at": "2025-09-01T08:00:06Z", "status": "done" },
    { "target": "shares", "rightId": "share-1", "action": "revoke", "at": "2025-09-01T08:00:07Z", "status": "done" },
    { "target": "scheduled-workflows", "rightId": "wf-1", "action": "disable", "at": "2025-09-01T08:00:08Z", "status": "done" },
    { "target": "ai-tool-grants", "rightId": "ai-1", "action": "disable", "at": "2025-09-01T08:00:09Z", "status": "done" }
  ],
  "outstanding": [],
  "completeByDeadline": true,
  "status": "complete",
  "auditRef": "audit://offboarding/oidc|lena.larsen"
}
